USTREASURY/HQMYC,High Quality Market Corporate Bond Yield Curve Spot Rates
USTREASURY/TNMBOR,Treasury Net Nonmarketable Borrowing
USTREASURY/MKTDM,Marketable Debt Maturing in Next 12 to 36 Months
USTREASURY/BRDNM,Breakdown of Marketable Issuance
USTREASURY/TMBOR,Treasury Net Marketable Borrowing
USTREASURY/YIELD,Treasury Yield Curve Rates
USTREASURY/LONGTERMRATES,Treasury Long Term Rates
USTREASURY/BILLRATES,Treasury Bill Rates
USTREASURY/REALLONGTERM,Treasury Real Long-Term Rates
USTREASURY/AVMAT,Average Maturity of Total Outstanding Treasury Marketable Securities
USTREASURY/MATDIS,Maturity Distribution and Average Length of Marketable Interest-Bearing Public Debt
USTREASURY/REALYIELD,Treasury Real Yield Curve Rates
